No.,Time,Source,Destination,Protocol,Length,Frame,Time delta from previous displayed frame,Info,,,,,,,,,,,Time 2,Time 1,Delay,delay 2,delay 1,jitter
1,0,192.168.43.13,114.122.0.145,TCP,54,â\234\223,0,"49985  >  443 [FIN, ACK] Seq=1 Ack=1 Win=2760 Len=0",,,,,,,,,,,0.000423,0,0.000423,0.298925,0.000423,0.298502
2,0.000423,192.168.43.13,74.125.200.136,TCP,54,â\234\223,0.000423,"49986  >  443 [FIN, ACK] Seq=1 Ack=1 Win=253 Len=0",,,,,,,,,,,0.299348,0.000423,0.298925,0.001014,0.298925,-0.297911
3,0.299348,192.168.43.13,114.122.0.145,TCP,54,â\234\223,0.298925,"[TCP Retransmission] 49985  >  443 [FIN, ACK] Seq=1 Ack=1 Win=2760 Len=0",,,,,,,,,,,0.300362,0.299348,0.001014,0.00175,0.001014,0.000736
4,0.300362,192.168.43.13,74.125.200.136,TCP,54,â\234\223,0.001014,"[TCP Retransmission] 49986  >  443 [FIN, ACK] Seq=1 Ack=1 Win=253 Len=0",,,,,,,,,,,0.302112,0.300362,0.00175,0.000153,0.00175,-0.001597
5,0.302112,114.122.0.145,192.168.43.13,TCP,54,â\234\223,0.00175,443  >  49985 [ACK] Seq=1 Ack=2 Win=804 Len=0,,,,,,,,,,,0.302265,0.302112,0.000153,0,0.000153,-0.000153
6,0.302265,74.125.200.136,192.168.43.13,TCP,54,â\234\223,0.000153,443  >  49986 [ACK] Seq=1 Ack=2 Win=746 Len=0,,,,,,,,,,,0.302265,0.302265,0,4.2E-05,0,4.2E-05
7,0.302265,114.122.0.145,192.168.43.13,TCP,54,â\234\223,0,"443  >  49985 [FIN, ACK] Seq=1 Ack=2 Win=804 Len=0",,,,,,,,,,,0.302307,0.302265,4.2E-05,0.009688,4.2E-05,0.009646
8,0.302307,192.168.43.13,114.122.0.145,TCP,54,â\234\223,0.000042,49985  >  443 [ACK] Seq=2 Ack=2 Win=2760 Len=0,,,,,,,,,,,0.311995,0.302307,0.009688,6.1E-05,0.009688,-0.009627
9,0.311995,74.125.200.136,192.168.43.13,TCP,54,â\234\223,0.009688,"443  >  49986 [FIN, ACK] Seq=1 Ack=2 Win=746 Len=0",,,,,,,,,,,0.312056,0.311995,6.1E-05,2.094577,6.1E-05,2.094516
10,0.312056,192.168.43.13,74.125.200.136,TCP,54,â\234\223,0.000061,49986  >  443 [ACK] Seq=2 Ack=2 Win=253 Len=0,,,,,,,,,,,2.406633,0.312056,2.094577,0.063002,2.094577,-2.031575
11,2.406633,192.168.43.13,74.125.200.136,TCP,66,â\234\223,2.094577,49987  >  443 [SYN] Seq=0 Win=8192 Len=0 MSS=1460 WS=256 SACK_PERM=1,,,,,,,,,,,2.469635,2.406633,0.063002,0.00022,0.063002,-0.062782
12,2.469635,74.125.200.136,192.168.43.13,TCP,66,â\234\223,0.063002,"443  >  49987 [SYN, ACK] Seq=0 Ack=1 Win=22400 Len=0 MSS=1380 WS=32 SACK_PERM=1",,,,,,,,,,,2.469855,2.469635,0.00022,0.000822,0.00022,0.000602
13,2.469855,192.168.43.13,74.125.200.136,TCP,54,â\234\223,0.00022,49987  >  443 [ACK] Seq=1 Ack=1 Win=66048 Len=0,,,,,,,,,,,2.470677,2.469855,0.000822,0.036601,0.000822,0.035779
14,2.470677,192.168.43.13,74.125.200.136,TLSv1.3,639,â\234\223,0.000822,Client Hello,,,,,,,,,,,2.507278,2.470677,0.036601,0.028038,0.036601,-0.008563
15,2.507278,74.125.200.136,192.168.43.13,TCP,54,â\234\223,0.036601,443  >  49987 [ACK] Seq=1 Ack=586 Win=22656 Len=0,,,,,,,,,,,2.535316,2.507278,0.028038,0.003907,0.028038,-0.024131
16,2.535316,74.125.200.136,192.168.43.13,TLSv1.3,266,â\234\223,0.028038,"Server Hello, Change Cipher Spec, Application Data",,,,,,,,,,,2.539223,2.535316,0.003907,0.000553,0.003907,-0.003354
17,2.539223,192.168.43.13,74.125.200.136,TLSv1.3,118,â\234\223,0.003907,"Change Cipher Spec, Application Data",,,,,,,,,,,2.539776,2.539223,0.000553,0.000867,0.000553,0.000314
18,2.539776,192.168.43.13,74.125.200.136,TLSv1.3,146,â\234\223,0.000553,Application Data,,,,,,,,,,,2.540643,2.539776,0.000867,0.041311,0.000867,0.040444
19,2.540643,192.168.43.13,74.125.200.136,TLSv1.3,1062,â\234\223,0.000867,Application Data,,,,,,,,,,,2.581954,2.540643,0.041311,0.014156,0.041311,-0.027155
20,2.581954,74.125.200.136,192.168.43.13,TCP,54,â\234\223,0.041311,443  >  49987 [ACK] Seq=213 Ack=742 Win=22816 Len=0,,,,,,,,,,,2.59611,2.581954,0.014156,0.000286,0.014156,-0.01387
21,2.59611,74.125.200.136,192.168.43.13,TCP,54,â\234\223,0.014156,443  >  49987 [ACK] Seq=213 Ack=1750 Win=23808 Len=0,,,,,,,,,,,2.596396,2.59611,0.000286,0,0.000286,-0.000286
22,2.596396,74.125.200.136,192.168.43.13,TLSv1.3,634,â\234\223,0.000286,"Application Data, Application Data",,,,,,,,,,,2.596396,2.596396,0,0.0001,0,0.0001
23,2.596396,74.125.200.136,192.168.43.13,TLSv1.3,85,â\234\223,0,Application Data,,,,,,,,,,,2.596496,2.596396,0.0001,0.000424,0.0001,0.000324
24,2.596496,192.168.43.13,74.125.200.136,TCP,54,â\234\223,0.0001,49987  >  443 [ACK] Seq=1750 Ack=824 Win=65280 Len=0,,,,,,,,,,,2.59692,2.596496,0.000424,0.018266,0.000424,0.017842
25,2.59692,192.168.43.13,74.125.200.136,TLSv1.3,85,â\234\223,0.000424,Application Data,,,,,,,,,,,2.615186,2.59692,0.018266,0.000242,0.018266,-0.018024
26,2.615186,74.125.200.136,192.168.43.13,TLSv1.3,454,â\234\223,0.018266,Application Data,,,,,,,,,,,2.615428,2.615186,0.000242,0,0.000242,-0.000242
27,2.615428,74.125.200.136,192.168.43.13,TLSv1.3,85,â\234\223,0.000242,Application Data,,,,,,,,,,,2.615428,2.615428,0,7.4E-05,0,7.4E-05
28,2.615428,74.125.200.136,192.168.43.13,TLSv1.3,93,â\234\223,0,Application Data,,,,,,,,,,,2.615502,2.615428,7.4E-05,0.000747,7.4E-05,0.000673
29,2.615502,192.168.43.13,74.125.200.136,TCP,54,â\234\223,0.000074,49987  >  443 [ACK] Seq=1781 Ack=1294 Win=64768 Len=0,,,,,,,,,,,2.616249,2.615502,0.000747,0.013381,0.000747,0.012634
30,2.616249,192.168.43.13,74.125.200.136,TLSv1.3,93,â\234\223,0.000747,Application Data,,,,,,,,,,,2.62963,2.616249,0.013381,0.019394,0.013381,0.006013
32,2.62963,74.125.200.136,192.168.43.13,TCP,54,â\234\223,0.013381,443  >  49987 [ACK] Seq=1294 Ack=1781 Win=23840 Len=0,,,,,,,,,,,2.649024,2.62963,0.019394,0.010043,0.019394,-0.009351
33,2.649024,74.125.200.136,192.168.43.13,TCP,54,â\234\223,0.019394,443  >  49987 [ACK] Seq=1294 Ack=1820 Win=23872 Len=0,,,,,,,,,,,2.659067,2.649024,0.010043,0.041282,0.010043,0.031239
36,2.659067,192.168.43.13,172.217.194.94,TCP,66,â\234\223,0.010043,49988  >  443 [SYN] Seq=0 Win=8192 Len=0 MSS=1460 WS=256 SACK_PERM=1,,,,,,,,,,,2.700349,2.659067,0.041282,0.00022,0.041282,-0.041062
37,2.700349,172.217.194.94,192.168.43.13,TCP,66,â\234\223,0.041282,"443  >  49988 [SYN, ACK] Seq=0 Ack=1 Win=22400 Len=0 MSS=1380 WS=32 SACK_PERM=1",,,,,,,,,,,2.700569,2.700349,0.00022,0.000761,0.00022,0.000541
38,2.700569,192.168.43.13,172.217.194.94,TCP,54,â\234\223,0.00022,49988  >  443 [ACK] Seq=1 Ack=1 Win=66048 Len=0,,,,,,,,,,,2.70133,2.700569,0.000761,0.223392,0.000761,0.222631
39,2.70133,192.168.43.13,172.217.194.94,TLSv1.3,571,â\234\223,0.000761,Client Hello,,,,,,,,,,,2.924722,2.70133,0.223392,0.077498,0.223392,-0.145894
40,2.924722,192.168.43.13,172.217.194.94,TCP,66,â\234\223,0.223392,49989  >  443 [SYN] Seq=0 Win=8192 Len=0 MSS=1460 WS=256 SACK_PERM=1,,,,,,,,,,,3.00222,2.924722,0.077498,0.118188,0.077498,0.04069
41,3.00222,192.168.43.13,172.217.194.94,TCP,571,â\234\223,0.077498,"[TCP Retransmission] 49988  >  443 [PSH, ACK] Seq=1 Ack=1 Win=66048 Len=517",,,,,,,,,,,3.120408,3.00222,0.118188,0.000221,0.118188,-0.117967
42,3.120408,172.217.194.94,192.168.43.13,TCP,66,â\234\223,0.118188,"443  >  49989 [SYN, ACK] Seq=0 Ack=1 Win=22400 Len=0 MSS=1380 WS=32 SACK_PERM=1",,,,,,,,,,,3.120629,3.120408,0.000221,0.000359,0.000221,0.000138
43,3.120629,192.168.43.13,172.217.194.94,TCP,54,â\234\223,0.000221,49989  >  443 [ACK] Seq=1 Ack=1 Win=66048 Len=0,,,,,,,,,,,3.120988,3.120629,0.000359,0,0.000359,-0.000359
44,3.120988,172.217.194.94,192.168.43.13,TCP,54,â\234\223,0.000359,443  >  49988 [ACK] Seq=1 Ack=518 Win=22592 Len=0,,,,,,,,,,,3.120988,3.120988,0,0.000371,0,0.000371
45,3.120988,172.217.194.94,192.168.43.13,TCP,54,â\234\223,0,[TCP Dup ACK 44#1] 443  >  49988 [ACK] Seq=1 Ack=518 Win=22592 Len=0,,,,,,,,,,,3.121359,3.120988,0.000371,0.009206,0.000371,0.008835
46,3.121359,192.168.43.13,172.217.194.94,TLSv1.3,571,â\234\223,0.000371,Client Hello,,,,,,,,,,,3.130565,3.121359,0.009206,0.000862,0.009206,-0.008344
47,3.130565,172.217.194.94,192.168.43.13,TLSv1.3,1422,â\234\223,0.009206,"Server Hello, Change Cipher Spec",,,,,,,,,,,3.131427,3.130565,0.000862,8.1E-05,0.000862,-0.000781
48,3.131427,172.217.194.94,192.168.43.13,TLSv1.3,1357,â\234\223,0.000862,Application Data,,,,,,,,,,,3.131508,3.131427,8.1E-05,0.004835,8.1E-05,0.004754
49,3.131508,192.168.43.13,172.217.194.94,TCP,54,â\234\223,0.000081,49988  >  443 [ACK] Seq=518 Ack=2672 Win=66048 Len=0,,,,,,,,,,,3.136343,3.131508,0.004835,0.000565,0.004835,-0.00427
50,3.136343,192.168.43.13,172.217.194.94,TLSv1.3,118,â\234\223,0.004835,"Change Cipher Spec, Application Data",,,,,,,,,,,3.136908,3.136343,0.000565,0.000308,0.000565,-0.000257
51,3.136908,192.168.43.13,172.217.194.94,TCP,54,â\234\223,0.000565,"49989  >  443 [FIN, ACK] Seq=518 Ack=1 Win=66048 Len=0",,,,,,,,,,,3.137216,3.136908,0.000308,0.000572,0.000308,0.000264
52,3.137216,192.168.43.13,172.217.194.94,TLSv1.3,146,â\234\223,0.000308,Application Data,,,,,,,,,,,3.137788,3.137216,0.000572,0.000234,0.000572,-0.000338
53,3.137788,192.168.43.13,172.217.194.94,TLSv1.3,297,â\234\223,0.000572,Application Data,,,,,,,,,,,3.138022,3.137788,0.000234,0.000172,0.000234,-6.2E-05
54,3.138022,192.168.43.13,172.217.194.94,TLSv1.3,127,â\234\223,0.000234,Application Data,,,,,,,,,,,3.138194,3.138022,0.000172,0.000144,0.000172,-2.8E-05
55,3.138194,192.168.43.13,172.217.194.94,TLSv1.3,824,â\234\223,0.000172,Application Data,,,,,,,,,,,3.138338,3.138194,0.000144,0.028606,0.000144,0.028462
56,3.138338,192.168.43.13,172.217.194.94,TLSv1.3,390,â\234\223,0.000144,Application Data,,,,,,,,,,,3.166944,3.138338,0.028606,0.011005,0.028606,-0.017601
57,3.166944,172.217.194.94,192.168.43.13,TCP,54,â\234\223,0.028606,[TCP Window Update] 443  >  49989 [ACK] Seq=1 Ack=1 Win=22400 Len=0,,,,,,,,,,,3.177949,3.166944,0.011005,0.006503,0.011005,-0.004502
58,3.177949,172.217.194.94,192.168.43.13,TCP,54,â\234\223,0.011005,443  >  49989 [ACK] Seq=1 Ack=519 Win=22592 Len=0,,,,,,,,,,,3.184452,3.177949,0.006503,0.000223,0.006503,-0.00628
59,3.184452,172.217.194.94,192.168.43.13,TCP,54,â\234\223,0.006503,443  >  49988 [ACK] Seq=2672 Ack=674 Win=22752 Len=0,,,,,,,,,,,3.184675,3.184452,0.000223,0,0.000223,-0.000223
60,3.184675,172.217.194.94,192.168.43.13,TCP,54,â\234\223,0.000223,443  >  49988 [ACK] Seq=2672 Ack=917 Win=22976 Len=0,,,,,,,,,,,3.184675,3.184675,0,0.005248,0,0.005248
61,3.184675,172.217.194.94,192.168.43.13,TCP,54,â\234\223,0,443  >  49988 [ACK] Seq=2672 Ack=990 Win=23040 Len=0,,,,,,,,,,,3.189923,3.184675,0.005248,0.000109,0.005248,-0.005139
62,3.189923,172.217.194.94,192.168.43.13,TLSv1.3,1422,â\234\223,0.005248,"Server Hello, Change Cipher Spec",,,,,,,,,,,3.190032,3.189923,0.000109,0.000407,0.000109,0.000298
63,3.190032,192.168.43.13,172.217.194.94,TCP,54,â\234\223,0.000109,"49989  >  443 [RST, ACK] Seq=519 Ack=1369 Win=0 Len=0",,,,,,,,,,,3.190439,3.190032,0.000407,0,0.000407,-0.000407
64,3.190439,172.217.194.94,192.168.43.13,TLSv1.3,1356,â\234\223,0.000407,Application Data,,,,,,,,,,,3.190439,3.190439,0,0.014857,0,0.014857
65,3.190439,172.217.194.94,192.168.43.13,TCP,54,â\234\223,0,"443  >  49989 [FIN, ACK] Seq=2671 Ack=519 Win=22592 Len=0",,,,,,,,,,,3.205296,3.190439,0.014857,0.000484,0.014857,-0.014373
66,3.205296,172.217.194.94,192.168.43.13,TLSv1.3,634,â\234\223,0.014857,"Application Data, Application Data",,,,,,,,,,,3.20578,3.205296,0.000484,8.7E-05,0.000484,-0.000397
67,3.20578,172.217.194.94,192.168.43.13,TLSv1.3,85,â\234\223,0.000484,Application Data,,,,,,,,,,,3.205867,3.20578,8.7E-05,0.000458,8.7E-05,0.000371
68,3.205867,192.168.43.13,172.217.194.94,TCP,54,â\234\223,0.000087,49988  >  443 [ACK] Seq=2096 Ack=3283 Win=65536 Len=0,,,,,,,,,,,3.206325,3.205867,0.000458,0.000873,0.000458,0.000415
69,3.206325,192.168.43.13,172.217.194.94,TLSv1.3,85,â\234\223,0.000458,Application Data,,,,,,,,,,,3.207198,3.206325,0.000873,0.004691,0.000873,0.003818
70,3.207198,172.217.194.94,192.168.43.13,TCP,54,â\234\223,0.000873,443  >  49988 [ACK] Seq=3283 Ack=1760 Win=23808 Len=0,,,,,,,,,,,3.211889,3.207198,0.004691,0.006566,0.004691,0.001875
71,3.211889,172.217.194.94,192.168.43.13,TCP,54,â\234\223,0.004691,443  >  49988 [ACK] Seq=3283 Ack=2096 Win=24160 Len=0,,,,,,,,,,,3.218455,3.211889,0.006566,0.001932,0.006566,-0.004634
72,3.218455,172.217.194.94,192.168.43.13,TLSv1.3,1124,â\234\223,0.006566,"Application Data, Application Data",,,,,,,,,,,3.220387,3.218455,0.001932,8.4E-05,0.001932,-0.001848
73,3.220387,172.217.194.94,192.168.43.13,TLSv1.3,93,â\234\223,0.001932,Application Data,,,,,,,,,,,3.220471,3.220387,8.4E-05,0.000895,8.4E-05,0.000811
74,3.220471,192.168.43.13,172.217.194.94,TCP,54,â\234\223,0.000084,49988  >  443 [ACK] Seq=2127 Ack=4392 Win=66048 Len=0,,,,,,,,,,,3.221366,3.220471,0.000895,0.003902,0.000895,0.003007
75,3.221366,192.168.43.13,172.217.194.94,TLSv1.3,93,â\234\223,0.000895,Application Data,,,,,,,,,,,3.225268,3.221366,0.003902,0.00146,0.003902,-0.002442
76,3.225268,172.217.194.94,192.168.43.13,TLSv1.3,119,â\234\223,0.003902,Application Data,,,,,,,,,,,3.226728,3.225268,0.00146,0.000103,0.00146,-0.001357
77,3.226728,172.217.194.94,192.168.43.13,TLSv1.3,85,â\234\223,0.00146,Application Data,,,,,,,,,,,3.226831,3.226728,0.000103,0.019996,0.000103,0.019893
78,3.226831,192.168.43.13,172.217.194.94,TCP,54,â\234\223,0.000103,49988  >  443 [ACK] Seq=2166 Ack=4488 Win=66048 Len=0,,,,,,,,,,,3.246827,3.226831,0.019996,0.021939,0.019996,0.001943
79,3.246827,172.217.194.94,192.168.43.13,TCP,54,â\234\223,0.019996,443  >  49988 [ACK] Seq=4488 Ack=2127 Win=24192 Len=0,,,,,,,,,,,3.268766,3.246827,0.021939,3.508317,0.021939,3.486378
80,3.268766,172.217.194.94,192.168.43.13,TCP,54,â\234\223,0.021939,443  >  49988 [ACK] Seq=4488 Ack=2166 Win=24224 Len=0,,,,,,,,,,,6.777083,3.268766,3.508317,0.033015,3.508317,-3.475302
85,6.777083,192.168.43.13,114.122.0.145,TCP,66,â\234\223,3.508317,49990  >  443 [SYN] Seq=0 Win=8192 Len=0 MSS=1460 WS=256 SACK_PERM=1,,,,,,,,,,,6.810098,6.777083,0.033015,0.000212,0.033015,-0.032803
86,6.810098,114.122.0.145,192.168.43.13,TCP,66,â\234\223,0.033015,"443  >  49990 [SYN, ACK] Seq=0 Ack=1 Win=22400 Len=0 MSS=1380 WS=32 SACK_PERM=1",,,,,,,,,,,6.81031,6.810098,0.000212,0.001054,0.000212,0.000842
87,6.81031,192.168.43.13,114.122.0.145,TCP,54,â\234\223,0.000212,49990  >  443 [ACK] Seq=1 Ack=1 Win=66048 Len=0,,,,,,,,,,,6.811364,6.81031,0.001054,0.056085,0.001054,0.055031
88,6.811364,192.168.43.13,114.122.0.145,TLSv1.3,571,â\234\223,0.001054,Client Hello,,,,,,,,,,,6.867449,6.811364,0.056085,0.000536,0.056085,-0.055549
89,6.867449,114.122.0.145,192.168.43.13,TCP,54,â\234\223,0.056085,443  >  49990 [ACK] Seq=1 Ack=518 Win=22592 Len=0,,,,,,,,,,,6.867985,6.867449,0.000536,0,0.000536,-0.000536
90,6.867985,114.122.0.145,192.168.43.13,TLSv1.3,1422,â\234\223,0.000536,"Server Hello, Change Cipher Spec",,,,,,,,,,,6.867985,6.867985,0,0,0,0
91,6.867985,114.122.0.145,192.168.43.13,TCP,1422,â\234\223,0,443  >  49990 [ACK] Seq=1369 Ack=518 Win=22592 Len=1368 [TCP segment of a reassembled PDU],,,,,,,,,,,6.867985,6.867985,0,0.000135,0,0.000135
92,6.867985,114.122.0.145,192.168.43.13,TLSv1.3,623,â\234\223,0,Application Data,,,,,,,,,,,6.86812,6.867985,0.000135,0.00421,0.000135,0.004075
93,6.86812,192.168.43.13,114.122.0.145,TCP,54,â\234\223,0.000135,49990  >  443 [ACK] Seq=518 Ack=3306 Win=66048 Len=0,,,,,,,,,,,6.87233,6.86812,0.00421,0.000651,0.00421,-0.003559
94,6.87233,192.168.43.13,114.122.0.145,TLSv1.3,118,â\234\223,0.00421,"Change Cipher Spec, Application Data",,,,,,,,,,,6.872981,6.87233,0.000651,0,0.000651,-0.000651
95,6.872981,192.168.43.13,114.122.0.145,TCP,1434,â\234\223,0.000651,49990  >  443 [ACK] Seq=582 Ack=3306 Win=66048 Len=1380 [TCP segment of a reassembled PDU],,,,,,,,,,,6.872981,6.872981,0,0.026802,0,0.026802
96,6.872981,192.168.43.13,114.122.0.145,TLSv1.3,282,â\234\223,0,Application Data,,,,,,,,,,,6.899783,6.872981,0.026802,0.011976,0.026802,-0.014826
97,6.899783,114.122.0.145,192.168.43.13,TCP,54,â\234\223,0.026802,443  >  49990 [ACK] Seq=3306 Ack=582 Win=22656 Len=0,,,,,,,,,,,6.911759,6.899783,0.011976,0.00128,0.011976,-0.010696
98,6.911759,114.122.0.145,192.168.43.13,TCP,54,â\234\223,0.011976,443  >  49990 [ACK] Seq=3306 Ack=1962 Win=24032 Len=0,,,,,,,,,,,6.913039,6.911759,0.00128,0,0.00128,-0.00128
99,6.913039,114.122.0.145,192.168.43.13,TCP,54,â\234\223,0.00128,443  >  49990 [ACK] Seq=3306 Ack=2190 Win=24256 Len=0,,,,,,,,,,,6.913039,6.913039,0,0,0,0
100,6.913039,114.122.0.145,192.168.43.13,TLSv1.3,1422,â\234\223,0,"Application Data, Application Data",,,,,,,,,,,6.913039,6.913039,0,0,0,0
101,6.913039,114.122.0.145,192.168.43.13,TCP,1422,â\234\223,0,443  >  49990 [ACK] Seq=4674 Ack=2190 Win=24256 Len=1368 [TCP segment of a reassembled PDU],,,,,,,,,,,6.913039,6.913039,0,0,0,0
102,6.913039,114.122.0.145,192.168.43.13,TCP,1422,â\234\223,0,443  >  49990 [ACK] Seq=6042 Ack=2190 Win=24256 Len=1368 [TCP segment of a reassembled PDU],,,,,,,,,,,6.913039,6.913039,0,0,0,0
103,6.913039,114.122.0.145,192.168.43.13,TCP,1422,â\234\223,0,443  >  49990 [ACK] Seq=7410 Ack=2190 Win=24256 Len=1368 [TCP segment of a reassembled PDU],,,,,,,,,,,6.913039,6.913039,0,0,0,0
104,6.913039,114.122.0.145,192.168.43.13,TCP,1422,â\234\223,0,443  >  49990 [ACK] Seq=8778 Ack=2190 Win=24256 Len=1368 [TCP segment of a reassembled PDU],,,,,,,,,,,6.913039,6.913039,0,0.00015,0,0.00015
105,6.913039,114.122.0.145,192.168.43.13,TCP,1422,â\234\223,0,"443  >  49990 [PSH, ACK] Seq=10146 Ack=2190 Win=24256 Len=1368 [TCP segment of a reassembled PDU]",,,,,,,,,,,6.913189,6.913039,0.00015,0.000533,0.00015,0.000383
106,6.913189,192.168.43.13,114.122.0.145,TCP,54,â\234\223,0.00015,49990  >  443 [ACK] Seq=2190 Ack=11514 Win=66048 Len=0,,,,,,,,,,,6.913722,6.913189,0.000533,0,0.000533,-0.000533
107,6.913722,114.122.0.145,192.168.43.13,TCP,1422,â\234\223,0.000533,443  >  49990 [ACK] Seq=11514 Ack=2190 Win=24256 Len=1368 [TCP segment of a reassembled PDU],,,,,,,,,,,6.913722,6.913722,0,9.1E-05,0,9.1E-05
108,6.913722,114.122.0.145,192.168.43.13,TCP,1422,â\234\223,0,443  >  49990 [ACK] Seq=12882 Ack=2190 Win=24256 Len=1368 [TCP segment of a reassembled PDU],,,,,,,,,,,6.913813,6.913722,9.1E-05,0.002423,9.1E-05,0.002332
109,6.913813,192.168.43.13,114.122.0.145,TCP,54,â\234\223,0.000091,49990  >  443 [ACK] Seq=2190 Ack=14250 Win=66048 Len=0,,,,,,,,,,,6.916236,6.913813,0.002423,0.000817,0.002423,-0.001606
110,6.916236,114.122.0.145,192.168.43.13,TCP,1422,â\234\223,0.002423,443  >  49990 [ACK] Seq=14250 Ack=2190 Win=24256 Len=1368 [TCP segment of a reassembled PDU],,,,,,,,,,,6.917053,6.916236,0.000817,0,0.000817,-0.000817
111,6.917053,114.122.0.145,192.168.43.13,TCP,1422,â\234\223,0.000817,443  >  49990 [ACK] Seq=15618 Ack=2190 Win=24256 Len=1368 [TCP segment of a reassembled PDU],,,,,,,,,,,6.917053,6.917053,0,0,0,0
112,6.917053,114.122.0.145,192.168.43.13,TCP,1422,â\234\223,0,443  >  49990 [ACK] Seq=16986 Ack=2190 Win=24256 Len=1368 [TCP segment of a reassembled PDU],,,,,,,,,,,6.917053,6.917053,0,0,0,0
113,6.917053,114.122.0.145,192.168.43.13,TCP,1422,â\234\223,0,443  >  49990 [ACK] Seq=18354 Ack=2190 Win=24256 Len=1368 [TCP segment of a reassembled PDU],,,,,,,,,,,6.917053,6.917053,0,0,0,0
114,6.917053,114.122.0.145,192.168.43.13,TLSv1.3,1422,â\234\223,0,Application Data [TCP segment of a reassembled PDU],,,,,,,,,,,6.917053,6.917053,0,0.000121,0,0.000121
115,6.917053,114.122.0.145,192.168.43.13,TCP,1422,â\234\223,0,443  >  49990 [ACK] Seq=21090 Ack=2190 Win=24256 Len=1368 [TCP segment of a reassembled PDU],,,,,,,,,,,6.917174,6.917053,0.000121,0.010525,0.000121,0.010404
116,6.917174,192.168.43.13,114.122.0.145,TCP,54,â\234\223,0.000121,49990  >  443 [ACK] Seq=2190 Ack=22458 Win=66048 Len=0,,,,,,,,,,,6.927699,6.917174,0.010525,0.000937,0.010525,-0.009588
117,6.927699,114.122.0.145,192.168.43.13,TCP,1422,â\234\223,0.010525,443  >  49990 [ACK] Seq=22458 Ack=2190 Win=24256 Len=1368 [TCP segment of a reassembled PDU],,,,,,,,,,,6.928636,6.927699,0.000937,0,0.000937,-0.000937
118,6.928636,114.122.0.145,192.168.43.13,TCP,1422,â\234\223,0.000937,443  >  49990 [ACK] Seq=23826 Ack=2190 Win=24256 Len=1368 [TCP segment of a reassembled PDU],,,,,,,,,,,6.928636,6.928636,0,0,0,0
119,6.928636,114.122.0.145,192.168.43.13,TCP,1422,â\234\223,0,443  >  49990 [ACK] Seq=25194 Ack=2190 Win=24256 Len=1368 [TCP segment of a reassembled PDU],,,,,,,,,,,6.928636,6.928636,0,0,0,0
120,6.928636,114.122.0.145,192.168.43.13,TCP,1422,â\234\223,0,"443  >  49990 [PSH, ACK] Seq=26562 Ack=2190 Win=24256 Len=1368 [TCP segment of a reassembled PDU]",,,,,,,,,,,6.928636,6.928636,0,0.000127,0,0.000127
121,6.928636,114.122.0.145,192.168.43.13,TCP,270,â\234\223,0,"443  >  49990 [PSH, ACK] Seq=27930 Ack=2190 Win=24256 Len=216 [TCP segment of a reassembled PDU]",,,,,,,,,,,6.928763,6.928636,0.000127,0.013477,0.000127,0.01335
122,6.928763,192.168.43.13,114.122.0.145,TCP,54,â\234\223,0.000127,49990  >  443 [ACK] Seq=2190 Ack=28146 Win=66048 Len=0,,,,,,,,,,,6.94224,6.928763,0.013477,0.000125,0.013477,-0.013352
123,6.94224,114.122.0.145,192.168.43.13,TCP,1206,â\234\223,0.013477,443  >  49990 [ACK] Seq=28146 Ack=2190 Win=24256 Len=1152 [TCP segment of a reassembled PDU],,,,,,,,,,,6.942365,6.94224,0.000125,0.001482,0.000125,0.001357
124,6.942365,192.168.43.13,114.122.0.145,TCP,54,â\234\223,0.000125,49990  >  443 [ACK] Seq=2190 Ack=29298 Win=65024 Len=0,,,,,,,,,,,6.943847,6.942365,0.001482,0,0.001482,-0.001482
125,6.943847,114.122.0.145,192.168.43.13,TCP,1422,â\234\223,0.001482,443  >  49990 [ACK] Seq=29298 Ack=2190 Win=24256 Len=1368 [TCP segment of a reassembled PDU],,,,,,,,,,,6.943847,6.943847,0,0,0,0
126,6.943847,114.122.0.145,192.168.43.13,TCP,1422,â\234\223,0,443  >  49990 [ACK] Seq=30666 Ack=2190 Win=24256 Len=1368 [TCP segment of a reassembled PDU],,,,,,,,,,,6.943847,6.943847,0,0,0,0
127,6.943847,114.122.0.145,192.168.43.13,TCP,1422,â\234\223,0,443  >  49990 [ACK] Seq=32034 Ack=2190 Win=24256 Len=1368 [TCP segment of a reassembled PDU],,,,,,,,,,,6.943847,6.943847,0,0,0,0
128,6.943847,114.122.0.145,192.168.43.13,TCP,1422,â\234\223,0,443  >  49990 [ACK] Seq=33402 Ack=2190 Win=24256 Len=1368 [TCP segment of a reassembled PDU],,,,,,,,,,,6.943847,6.943847,0,0,0,0
129,6.943847,114.122.0.145,192.168.43.13,TCP,1422,â\234\223,0,443  >  49990 [ACK] Seq=34770 Ack=2190 Win=24256 Len=1368 [TCP segment of a reassembled PDU],,,,,,,,,,,6.943847,6.943847,0,0,0,0
130,6.943847,114.122.0.145,192.168.43.13,TLSv1.3,1422,â\234\223,0,Application Data [TCP segment of a reassembled PDU],,,,,,,,,,,6.943847,6.943847,0,0,0,0
131,6.943847,114.122.0.145,192.168.43.13,TCP,1422,â\234\223,0,443  >  49990 [ACK] Seq=37506 Ack=2190 Win=24256 Len=1368 [TCP segment of a reassembled PDU],,,,,,,,,,,6.943847,6.943847,0,0,0,0
132,6.943847,114.122.0.145,192.168.43.13,TCP,1422,â\234\223,0,443  >  49990 [ACK] Seq=38874 Ack=2190 Win=24256 Len=1368 [TCP segment of a reassembled PDU],,,,,,,,,,,6.943847,6.943847,0,0.00019,0,0.00019
133,6.943847,114.122.0.145,192.168.43.13,TCP,1422,â\234\223,0,"443  >  49990 [PSH, ACK] Seq=40242 Ack=2190 Win=24256 Len=1368 [TCP segment of a reassembled PDU]",,,,,,,,,,,6.944037,6.943847,0.00019,0.013222,0.00019,0.013032
134,6.944037,192.168.43.13,114.122.0.145,TCP,54,â\234\223,0.00019,49990  >  443 [ACK] Seq=2190 Ack=41610 Win=66048 Len=0,,,,,,,,,,,6.957259,6.944037,0.013222,7.7E-05,0.013222,-0.013145
135,6.957259,114.122.0.145,192.168.43.13,TCP,1422,â\234\223,0.013222,443  >  49990 [ACK] Seq=41610 Ack=2190 Win=24256 Len=1368 [TCP segment of a reassembled PDU],,,,,,,,,,,6.957336,6.957259,7.7E-05,0.003314,7.7E-05,0.003237
136,6.957336,192.168.43.13,114.122.0.145,TCP,54,â\234\223,0.000077,49990  >  443 [ACK] Seq=2190 Ack=42978 Win=64768 Len=0,,,,,,,,,,,6.96065,6.957336,0.003314,0,0.003314,-0.003314
137,6.96065,114.122.0.145,192.168.43.13,TCP,1422,â\234\223,0.003314,443  >  49990 [ACK] Seq=42978 Ack=2190 Win=24256 Len=1368 [TCP segment of a reassembled PDU],,,,,,,,,,,6.96065,6.96065,0,0,0,0
138,6.96065,114.122.0.145,192.168.43.13,TCP,1422,â\234\223,0,443  >  49990 [ACK] Seq=44346 Ack=2190 Win=24256 Len=1368 [TCP segment of a reassembled PDU],,,,,,,,,,,6.96065,6.96065,0,0,0,0
139,6.96065,114.122.0.145,192.168.43.13,TCP,1422,â\234\223,0,443  >  49990 [ACK] Seq=45714 Ack=2190 Win=24256 Len=1368 [TCP segment of a reassembled PDU],,,,,,,,,,,6.96065,6.96065,0,0,0,0
140,6.96065,114.122.0.145,192.168.43.13,TCP,1422,â\234\223,0,443  >  49990 [ACK] Seq=47082 Ack=2190 Win=24256 Len=1368 [TCP segment of a reassembled PDU],,,,,,,,,,,6.96065,6.96065,0,0,0,0
141,6.96065,114.122.0.145,192.168.43.13,TCP,1422,â\234\223,0,443  >  49990 [ACK] Seq=48450 Ack=2190 Win=24256 Len=1368 [TCP segment of a reassembled PDU],,,,,,,,,,,6.96065,6.96065,0,0,0,0
142,6.96065,114.122.0.145,192.168.43.13,TCP,1422,â\234\223,0,443  >  49990 [ACK] Seq=49818 Ack=2190 Win=24256 Len=1368 [TCP segment of a reassembled PDU],,,,,,,,,,,6.96065,6.96065,0,0,0,0
143,6.96065,114.122.0.145,192.168.43.13,TCP,1422,â\234\223,0,443  >  49990 [ACK] Seq=51186 Ack=2190 Win=24256 Len=1368 [TCP segment of a reassembled PDU],,,,,,,,,,,6.96065,6.96065,0,0,0,0
144,6.96065,114.122.0.145,192.168.43.13,TLSv1.3,1422,â\234\223,0,Application Data [TCP segment of a reassembled PDU],,,,,,,,,,,6.96065,6.96065,0,0.00011,0,0.00011
145,6.96065,114.122.0.145,192.168.43.13,TCP,1422,â\234\223,0,443  >  49990 [ACK] Seq=53922 Ack=2190 Win=24256 Len=1368 [TCP segment of a reassembled PDU],,,,,,,,,,,6.96076,6.96065,0.00011,0.000951,0.00011,0.000841
146,6.96076,192.168.43.13,114.122.0.145,TCP,54,â\234\223,0.00011,49990  >  443 [ACK] Seq=2190 Ack=55290 Win=66048 Len=0,,,,,,,,,,,6.961711,6.96076,0.000951,0,0.000951,-0.000951
147,6.961711,114.122.0.145,192.168.43.13,TCP,1422,â\234\223,0.000951,443  >  49990 [ACK] Seq=55290 Ack=2190 Win=24256 Len=1368 [TCP segment of a reassembled PDU],,,,,,,,,,,6.961711,6.961711,0,6.2E-05,0,6.2E-05
148,6.961711,114.122.0.145,192.168.43.13,TCP,1422,â\234\223,0,"443  >  49990 [PSH, ACK] Seq=56658 Ack=2190 Win=24256 Len=1368 [TCP segment of a reassembled PDU]",,,,,,,,,,,6.961773,6.961711,6.2E-05,0.015843,6.2E-05,0.015781
149,6.961773,192.168.43.13,114.122.0.145,TCP,54,â\234\223,0.000062,49990  >  443 [ACK] Seq=2190 Ack=58026 Win=66048 Len=0,,,,,,,,,,,6.977616,6.961773,0.015843,7.7E-05,0.015843,-0.015766
150,6.977616,114.122.0.145,192.168.43.13,TCP,1422,â\234\223,0.015843,443  >  49990 [ACK] Seq=58026 Ack=2190 Win=24256 Len=1368 [TCP segment of a reassembled PDU],,,,,,,,,,,6.977693,6.977616,7.7E-05,0.000277,7.7E-05,0.0002
151,6.977693,192.168.43.13,114.122.0.145,TCP,54,â\234\223,0.000077,49990  >  443 [ACK] Seq=2190 Ack=59394 Win=64768 Len=0,,,,,,,,,,,6.97797,6.977693,0.000277,0.006435,0.000277,0.006158
152,6.97797,114.122.0.145,192.168.43.13,TCP,1422,â\234\223,0.000277,443  >  49990 [ACK] Seq=59394 Ack=2190 Win=24256 Len=1368 [TCP segment of a reassembled PDU],,,,,,,,,,,6.984405,6.97797,0.006435,0,0.006435,-0.006435
153,6.984405,114.122.0.145,192.168.43.13,TCP,1422,â\234\223,0.006435,443  >  49990 [ACK] Seq=60762 Ack=2190 Win=24256 Len=1368 [TCP segment of a reassembled PDU],,,,,,,,,,,6.984405,6.984405,0,0,0,0
154,6.984405,114.122.0.145,192.168.43.13,TCP,1422,â\234\223,0,443  >  49990 [ACK] Seq=62130 Ack=2190 Win=24256 Len=1368 [TCP segment of a reassembled PDU],,,,,,,,,,,6.984405,6.984405,0,0,0,0
155,6.984405,114.122.0.145,192.168.43.13,TCP,1422,â\234\223,0,443  >  49990 [ACK] Seq=63498 Ack=2190 Win=24256 Len=1368 [TCP segment of a reassembled PDU],,,,,,,,,,,6.984405,6.984405,0,0,0,0
156,6.984405,114.122.0.145,192.168.43.13,TCP,1422,â\234\223,0,443  >  49990 [ACK] Seq=64866 Ack=2190 Win=24256 Len=1368 [TCP segment of a reassembled PDU],,,,,,,,,,,6.984405,6.984405,0,0,0,0
157,6.984405,114.122.0.145,192.168.43.13,TCP,1422,â\234\223,0,443  >  49990 [ACK] Seq=66234 Ack=2190 Win=24256 Len=1368 [TCP segment of a reassembled PDU],,,,,,,,,,,6.984405,6.984405,0,0,0,0
158,6.984405,114.122.0.145,192.168.43.13,TCP,1422,â\234\223,0,443  >  49990 [ACK] Seq=67602 Ack=2190 Win=24256 Len=1368 [TCP segment of a reassembled PDU],,,,,,,,,,,6.984405,6.984405,0,0,0,0
159,6.984405,114.122.0.145,192.168.43.13,TLSv1.3,1422,â\234\223,0,Application Data [TCP segment of a reassembled PDU],,,,,,,,,,,6.984405,6.984405,0,9.6E-05,0,9.6E-05
160,6.984405,114.122.0.145,192.168.43.13,TCP,1422,â\234\223,0,443  >  49990 [ACK] Seq=70338 Ack=2190 Win=24256 Len=1368 [TCP segment of a reassembled PDU],,,,,,,,,,,6.984501,6.984405,9.6E-05,0.001502,9.6E-05,0.001406
161,6.984501,192.168.43.13,114.122.0.145,TCP,54,â\234\223,0.000096,49990  >  443 [ACK] Seq=2190 Ack=71706 Win=66048 Len=0,,,,,,,,,,,6.986003,6.984501,0.001502,6.5E-05,0.001502,-0.001437
162,6.986003,114.122.0.145,192.168.43.13,TCP,1422,â\234\223,0.001502,443  >  49990 [ACK] Seq=71706 Ack=2190 Win=24256 Len=1368 [TCP segment of a reassembled PDU],,,,,,,,,,,6.986068,6.986003,6.5E-05,0.000327,6.5E-05,0.000262
163,6.986068,192.168.43.13,114.122.0.145,TCP,54,â\234\223,0.000065,49990  >  443 [ACK] Seq=2190 Ack=73074 Win=64768 Len=0,,,,,,,,,,,6.986395,6.986068,0.000327,0.004719,0.000327,0.004392
164,6.986395,114.122.0.145,192.168.43.13,TCP,1422,â\234\223,0.000327,"443  >  49990 [PSH, ACK] Seq=73074 Ack=2190 Win=24256 Len=1368 [TCP segment of a reassembled PDU]",,,,,,,,,,,6.991114,6.986395,0.004719,5.8E-05,0.004719,-0.004661
165,6.991114,114.122.0.145,192.168.43.13,TCP,1422,â\234\223,0.004719,443  >  49990 [ACK] Seq=74442 Ack=2190 Win=24256 Len=1368 [TCP segment of a reassembled PDU],,,,,,,,,,,6.991172,6.991114,5.8E-05,0.00368,5.8E-05,0.003622
166,6.991172,192.168.43.13,114.122.0.145,TCP,54,â\234\223,0.000058,49990  >  443 [ACK] Seq=2190 Ack=75810 Win=66048 Len=0,,,,,,,,,,,6.994852,6.991172,0.00368,0,0.00368,-0.00368
167,6.994852,114.122.0.145,192.168.43.13,TCP,1422,â\234\223,0.00368,"443  >  49990 [PSH, ACK] Seq=75810 Ack=2190 Win=24256 Len=1368 [TCP segment of a reassembled PDU]",,,,,,,,,,,6.994852,6.994852,0,0,0,0
168,6.994852,114.122.0.145,192.168.43.13,TCP,1422,â\234\223,0,443  >  49990 [ACK] Seq=77178 Ack=2190 Win=24256 Len=1368 [TCP segment of a reassembled PDU],,,,,,,,,,,6.994852,6.994852,0,0,0,0
169,6.994852,114.122.0.145,192.168.43.13,TCP,1422,â\234\223,0,443  >  49990 [ACK] Seq=78546 Ack=2190 Win=24256 Len=1368 [TCP segment of a reassembled PDU],,,,,,,,,,,6.994852,6.994852,0,0,0,0
170,6.994852,114.122.0.145,192.168.43.13,TCP,1422,â\234\223,0,443  >  49990 [ACK] Seq=79914 Ack=2190 Win=24256 Len=1368 [TCP segment of a reassembled PDU],,,,,,,,,,,6.994852,6.994852,0,0,0,0
171,6.994852,114.122.0.145,192.168.43.13,TCP,1422,â\234\223,0,443  >  49990 [ACK] Seq=81282 Ack=2190 Win=24256 Len=1368 [TCP segment of a reassembled PDU],,,,,,,,,,,6.994852,6.994852,0,0,0,0
172,6.994852,114.122.0.145,192.168.43.13,TCP,1422,â\234\223,0,443  >  49990 [ACK] Seq=82650 Ack=2190 Win=24256 Len=1368 [TCP segment of a reassembled PDU],,,,,,,,,,,6.994852,6.994852,0,0,0,0
173,6.994852,114.122.0.145,192.168.43.13,TCP,1422,â\234\223,0,443  >  49990 [ACK] Seq=84018 Ack=2190 Win=24256 Len=1368 [TCP segment of a reassembled PDU],,,,,,,,,,,6.994852,6.994852,0,0,0,0
174,6.994852,114.122.0.145,192.168.43.13,TLSv1.3,1422,â\234\223,0,Application Data [TCP segment of a reassembled PDU],,,,,,,,,,,6.994852,6.994852,0,0,0,0
175,6.994852,114.122.0.145,192.168.43.13,TCP,1422,â\234\223,0,443  >  49990 [ACK] Seq=86754 Ack=2190 Win=24256 Len=1368 [TCP segment of a reassembled PDU],,,,,,,,,,,6.994852,6.994852,0,0.000109,0,0.000109
176,6.994852,114.122.0.145,192.168.43.13,TCP,1422,â\234\223,0,443  >  49990 [ACK] Seq=88122 Ack=2190 Win=24256 Len=1368 [TCP segment of a reassembled PDU],,,,,,,,,,,6.994961,6.994852,0.000109,0.005145,0.000109,0.005036
177,6.994961,192.168.43.13,114.122.0.145,TCP,54,â\234\223,0.000109,49990  >  443 [ACK] Seq=2190 Ack=89490 Win=66048 Len=0,,,,,,,,,,,7.000106,6.994961,0.005145,0.000647,0.005145,-0.004498
178,7.000106,114.122.0.145,192.168.43.13,TCP,1422,â\234\223,0.005145,443  >  49990 [ACK] Seq=89490 Ack=2190 Win=24256 Len=1368 [TCP segment of a reassembled PDU],,,,,,,,,,,7.000753,7.000106,0.000647,0,0.000647,-0.000647
179,7.000753,114.122.0.145,192.168.43.13,TCP,1422,â\234\223,0.000647,443  >  49990 [ACK] Seq=90858 Ack=2190 Win=24256 Len=1368 [TCP segment of a reassembled PDU],,,,,,,,,,,7.000753,7.000753,0,0,0,0
180,7.000753,114.122.0.145,192.168.43.13,TCP,1422,â\234\223,0,443  >  49990 [ACK] Seq=92226 Ack=2190 Win=24256 Len=1368 [TCP segment of a reassembled PDU],,,,,,,,,,,7.000753,7.000753,0,5.3E-05,0,5.3E-05
181,7.000753,114.122.0.145,192.168.43.13,TCP,1422,â\234\223,0,"443  >  49990 [PSH, ACK] Seq=93594 Ack=2190 Win=24256 Len=1368 [TCP segment of a reassembled PDU]",,,,,,,,,,,7.000806,7.000753,5.3E-05,0.018439,5.3E-05,0.018386
182,7.000806,192.168.43.13,114.122.0.145,TCP,54,â\234\223,0.000053,49990  >  443 [ACK] Seq=2190 Ack=94962 Win=66048 Len=0,,,,,,,,,,,7.019245,7.000806,0.018439,0,0.018439,-0.018439
183,7.019245,114.122.0.145,192.168.43.13,TCP,1422,â\234\223,0.018439,443  >  49990 [ACK] Seq=94962 Ack=2190 Win=24256 Len=1368 [TCP segment of a reassembled PDU],,,,,,,,,,,7.019245,7.019245,0,0,0,0
184,7.019245,114.122.0.145,192.168.43.13,TCP,1422,â\234\223,0,443  >  49990 [ACK] Seq=96330 Ack=2190 Win=24256 Len=1368 [TCP segment of a reassembled PDU],,,,,,,,,,,7.019245,7.019245,0,8.4E-05,0,8.4E-05
185,7.019245,114.122.0.145,192.168.43.13,TCP,1422,â\234\223,0,443  >  49990 [ACK] Seq=97698 Ack=2190 Win=24256 Len=1368 [TCP segment of a reassembled PDU],,,,,,,,,,,7.019329,7.019245,8.4E-05,0.000374,8.4E-05,0.00029
186,7.019329,192.168.43.13,114.122.0.145,TCP,54,â\234\223,0.000084,49990  >  443 [ACK] Seq=2190 Ack=99066 Win=66048 Len=0,,,,,,,,,,,7.019703,7.019329,0.000374,0,0.000374,-0.000374
187,7.019703,114.122.0.145,192.168.43.13,TCP,1422,â\234\223,0.000374,443  >  49990 [ACK] Seq=99066 Ack=2190 Win=24256 Len=1368 [TCP segment of a reassembled PDU],,,,,,,,,,,7.019703,7.019703,0,3.8E-05,0,3.8E-05
188,7.019703,114.122.0.145,192.168.43.13,TCP,1422,â\234\223,0,443  >  49990 [ACK] Seq=100434 Ack=2190 Win=24256 Len=1368 [TCP segment of a reassembled PDU],,,,,,,,,,,7.019741,7.019703,3.8E-05,0.002423,3.8E-05,0.002385
189,7.019741,192.168.43.13,114.122.0.145,TCP,54,â\234\223,0.000038,49990  >  443 [ACK] Seq=2190 Ack=101802 Win=66048 Len=0,,,,,,,,,,,7.022164,7.019741,0.002423,4.9E-05,0.002423,-0.002374
190,7.022164,114.122.0.145,192.168.43.13,TLSv1.3,1422,â\234\223,0.002423,Application Data [TCP segment of a reassembled PDU],,,,,,,,,,,7.022213,7.022164,4.9E-05,0.00122,4.9E-05,0.001171
191,7.022213,192.168.43.13,114.122.0.145,TCP,54,â\234\223,0.000049,49990  >  443 [ACK] Seq=2190 Ack=103170 Win=64768 Len=0,,,,,,,,,,,7.023433,7.022213,0.00122,0,0.00122,-0.00122
192,7.023433,114.122.0.145,192.168.43.13,TCP,1422,â\234\223,0.00122,443  >  49990 [ACK] Seq=103170 Ack=2190 Win=24256 Len=1368 [TCP segment of a reassembled PDU],,,,,,,,,,,7.023433,7.023433,0,0,0,0
193,7.023433,114.122.0.145,192.168.43.13,TCP,1422,â\234\223,0,443  >  49990 [ACK] Seq=104538 Ack=2190 Win=24256 Len=1368 [TCP segment of a reassembled PDU],,,,,,,,,,,7.023433,7.023433,0,0,0,0
194,7.023433,114.122.0.145,192.168.43.13,TCP,1422,â\234\223,0,443  >  49990 [ACK] Seq=105906 Ack=2190 Win=24256 Len=1368 [TCP segment of a reassembled PDU],,,,,,,,,,,7.023433,7.023433,0,0,0,0
195,7.023433,114.122.0.145,192.168.43.13,TCP,1422,â\234\223,0,443  >  49990 [ACK] Seq=107274 Ack=2190 Win=24256 Len=1368 [TCP segment of a reassembled PDU],,,,,,,,,,,7.023433,7.023433,0,0,0,0
196,7.023433,114.122.0.145,192.168.43.13,TCP,1422,â\234\223,0,443  >  49990 [ACK] Seq=108642 Ack=2190 Win=24256 Len=1368 [TCP segment of a reassembled PDU],,,,,,,,,,,7.023433,7.023433,0,9.3E-05,0,9.3E-05
197,7.023433,114.122.0.145,192.168.43.13,TCP,1422,â\234\223,0,443  >  49990 [ACK] Seq=110010 Ack=2190 Win=24256 Len=1368 [TCP segment of a reassembled PDU],,,,,,,,,,,7.023526,7.023433,9.3E-05,0.000446,9.3E-05,0.000353
198,7.023526,192.168.43.13,114.122.0.145,TCP,54,â\234\223,0.000093,49990  >  443 [ACK] Seq=2190 Ack=111378 Win=66048 Len=0,,,,,,,,,,,7.023972,7.023526,0.000446,0.006559,0.000446,0.006113
199,7.023972,114.122.0.145,192.168.43.13,TCP,1422,â\234\223,0.000446,"443  >  49990 [PSH, ACK] Seq=111378 Ack=2190 Win=24256 Len=1368 [TCP segment of a reassembled PDU]",,,,,,,,,,,7.030531,7.023972,0.006559,5.5E-05,0.006559,-0.006504
200,7.030531,114.122.0.145,192.168.43.13,TCP,1422,â\234\223,0.006559,443  >  49990 [ACK] Seq=112746 Ack=2190 Win=24256 Len=1368 [TCP segment of a reassembled PDU],,,,,,,,,,,7.030586,7.030531,5.5E-05,0.001975,5.5E-05,0.00192
201,7.030586,192.168.43.13,114.122.0.145,TCP,54,â\234\223,0.000055,49990  >  443 [ACK] Seq=2190 Ack=114114 Win=66048 Len=0,,,,,,,,,,,7.032561,7.030586,0.001975,0,0.001975,-0.001975
202,7.032561,114.122.0.145,192.168.43.13,TCP,1422,â\234\223,0.001975,443  >  49990 [ACK] Seq=114114 Ack=2190 Win=24256 Len=1368 [TCP segment of a reassembled PDU],,,,,,,,,,,7.032561,7.032561,0,0,0,0
203,7.032561,114.122.0.145,192.168.43.13,TCP,1422,â\234\223,0,443  >  49990 [ACK] Seq=115482 Ack=2190 Win=24256 Len=1368 [TCP segment of a reassembled PDU],,,,,,,,,,,7.032561,7.032561,0,0,0,0
204,7.032561,114.122.0.145,192.168.43.13,TCP,1422,â\234\223,0,443  >  49990 [ACK] Seq=116850 Ack=2190 Win=24256 Len=1368 [TCP segment of a reassembled PDU],,,,,,,,,,,7.032561,7.032561,0,0,0,0
205,7.032561,114.122.0.145,192.168.43.13,TLSv1.3,1422,â\234\223,0,Application Data [TCP segment of a reassembled PDU],,,,,,,,,,,7.032561,7.032561,0,0,0,0
206,7.032561,114.122.0.145,192.168.43.13,TCP,1422,â\234\223,0,443  >  49990 [ACK] Seq=119586 Ack=2190 Win=24256 Len=1368 [TCP segment of a reassembled PDU],,,,,,,,,,,7.032561,7.032561,0,0,0,0
207,7.032561,114.122.0.145,192.168.43.13,TCP,1422,â\234\223,0,443  >  49990 [ACK] Seq=120954 Ack=2190 Win=24256 Len=1368 [TCP segment of a reassembled PDU],,,,,,,,,,,7.032561,7.032561,0,0,0,0
208,7.032561,114.122.0.145,192.168.43.13,TCP,1422,â\234\223,0,443  >  49990 [ACK] Seq=122322 Ack=2190 Win=24256 Len=1368 [TCP segment of a reassembled PDU],,,,,,,,,,,7.032561,7.032561,0,0,0,0
209,7.032561,114.122.0.145,192.168.43.13,TCP,1422,â\234\223,0,443  >  49990 [ACK] Seq=123690 Ack=2190 Win=24256 Len=1368 [TCP segment of a reassembled PDU],,,,,,,,,,,7.032561,7.032561,0,0,0,0
210,7.032561,114.122.0.145,192.168.43.13,TCP,1422,â\234\223,0,443  >  49990 [ACK] Seq=125058 Ack=2190 Win=24256 Len=1368 [TCP segment of a reassembled PDU],,,,,,,,,,,7.032561,7.032561,0,0,0,0
211,7.032561,114.122.0.145,192.168.43.13,TCP,1422,â\234\223,0,443  >  49990 [ACK] Seq=126426 Ack=2190 Win=24256 Len=1368 [TCP segment of a reassembled PDU],,,,,,,,,,,7.032561,7.032561,0,9.3E-05,0,9.3E-05
212,7.032561,114.122.0.145,192.168.43.13,TCP,1422,â\234\223,0,443  >  49990 [ACK] Seq=127794 Ack=2190 Win=24256 Len=1368 [TCP segment of a reassembled PDU],,,,,,,,,,,7.032654,7.032561,9.3E-05,0.001387,9.3E-05,0.001294
213,7.032654,192.168.43.13,114.122.0.145,TCP,54,â\234\223,0.000093,49990  >  443 [ACK] Seq=2190 Ack=129162 Win=66048 Len=0,,,,,,,,,,,7.034041,7.032654,0.001387,0,0.001387,-0.001387
214,7.034041,114.122.0.145,192.168.43.13,TCP,1422,â\234\223,0.001387,443  >  49990 [ACK] Seq=129162 Ack=2190 Win=24256 Len=1368 [TCP segment of a reassembled PDU],,,,,,,,,,,7.034041,7.034041,0,0,0,0
215,7.034041,114.122.0.145,192.168.43.13,TCP,1422,â\234\223,0,"443  >  49990 [PSH, ACK] Seq=130530 Ack=2190 Win=24256 Len=1368 [TCP segment of a reassembled PDU]",,,,,,,,,,,7.034041,7.034041,0,0,0,0
216,7.034041,114.122.0.145,192.168.43.13,TCP,1422,â\234\223,0,443  >  49990 [ACK] Seq=131898 Ack=2190 Win=24256 Len=1368 [TCP segment of a reassembled PDU],,,,,,,,,,,7.034041,7.034041,0,0,0,0
217,7.034041,114.122.0.145,192.168.43.13,TCP,1422,â\234\223,0,443  >  49990 [ACK] Seq=133266 Ack=2190 Win=24256 Len=1368 [TCP segment of a reassembled PDU],,,,,,,,,,,7.034041,7.034041,0,0,0,0
218,7.034041,114.122.0.145,192.168.43.13,TLSv1.3,1422,â\234\223,0,Application Data [TCP segment of a reassembled PDU],,,,,,,,,,,7.034041,7.034041,0,0,0,0
219,7.034041,114.122.0.145,192.168.43.13,TCP,1422,â\234\223,0,443  >  49990 [ACK] Seq=136002 Ack=2190 Win=24256 Len=1368 [TCP segment of a reassembled PDU],,,,,,,,,,,7.034041,7.034041,0,0,0,0
220,7.034041,114.122.0.145,192.168.43.13,TCP,1422,â\234\223,0,443  >  49990 [ACK] Seq=137370 Ack=2190 Win=24256 Len=1368 [TCP segment of a reassembled PDU],,,,,,,,,,,7.034041,7.034041,0,0.000106,0,0.000106
